{
  "slug": "tools",
  "title": "Tools",
  "seo": {
    "description": "Image processing utilities, cross-platform apps, logging tools, and other open-source projects."
  },
  "widgets": [
    {
      "type": "intro",
      "props": {
        "title": "Tools",
        "paragraphs": [
          "Desktop utilities for texture workflows and compression prep, plus cross-platform apps, logging libraries, and other open-source projects."
        ]
      }
    },
    {
      "type": "project_grid",
      "props": {
        "cards": [
          {
            "title": "Web Portfolio Builder",
            "description": "Desktop app for editing portfolio and studio sites — build static pages and preview locally before publishing.",
            "tags": ["Desktop", "SiteBuilder"],
            "meta": "Web",
            "cta": {
              "label": "GitHub",
              "url": "https://github.com/AlexeyPerov/WebPortfolioBuilder"
            }
          },
          {
            "title": "SOCKS Proxy",
            "description": "Minimal macOS app to manage SSH SOCKS proxy connections with health checks and auto-reconnect.",
            "tags": ["Desktop", "Proxy"],
            "meta": "Proxy",
            "cta": {
              "label": "GitHub",
              "url": "https://github.com/AlexeyPerov/MacOS-SOCKS-Proxy"
            }
          },
          {
            "title": "Similar Textures Finder",
            "description": "Desktop app for finding duplicate and near-duplicate texture images.",
            "tags": ["Desktop", "Textures"],
            "meta": "Images",
            "cta": {
              "label": "GitHub",
              "url": "https://github.com/AlexeyPerov/SimilarTexturesFinder"
            }
          },
          {
            "title": "Crunch Textures",
            "description": "Check and resize textures for Crunch compression (width/height multiple of 4).",
            "tags": ["Desktop", "Textures"],
            "meta": "11 stars",
            "cta": {
              "label": "GitHub",
              "url": "https://github.com/AlexeyPerov/crunch_textures"
            }
          },
          {
            "title": "Log Keeper",
            "description": "Cross-platform log snapshot sharing (Flutter/Dart, Bloc, Firebase Firestore).",
            "tags": ["Flutter", "Logging"],
            "meta": "5 stars",
            "cta": {
              "label": "GitHub",
              "url": "https://github.com/AlexeyPerov/LogKeeper-Flutter-Firebase"
            }
          },
          {
            "title": "proviso",
            "description": "Flutter toolkit for conditional rendering, subtree wrapping, and handy dev shortcuts.",
            "tags": ["Flutter", "Toolkit"],
            "meta": "3 stars",
            "cta": {
              "label": "GitHub",
              "url": "https://github.com/AlexeyPerov/proviso"
            }
          }
        ]
      }
    }
  ]
}
