{
  "slug": "",
  "title": "My-Studio.Games",
  "seo": {
    "description": "My-Studio.Games is a mobile game studio creating polished casual games including Age of Coins and Magic Archer.",
    "og_image": "assets/logo.png"
  },
  "widgets": [
    {
      "type": "cover_banner",
      "props": {
        "src": "assets/logo.png",
        "alt": "My-Studio.Games"
      }
    },
    {
      "type": "intro",
      "props": {
        "title": "My-Studio.Games",
        "paragraphs": [
          "We are My-Studio.Games, a mobile game studio focused on creating engaging and highly polished casual experiences. The team specializes in addictive core loops and player-driven progression. With a strong emphasis on gameplay feel and retention, My-Studio.Games builds games that are easy to pick up and hard to put down.",
          "My-Studio.Games is a trademark of © Yadarko Trading Ltd"
        ]
      }
    },
    {
      "type": "apps_showcase",
      "props": {
        "section_title": "Our Games",
        "apps": [
          {
            "image": "assets/aoc-icon.png",
            "header_image": "assets/aoc_logo.png",
            "swiper_images": [
              "assets/aoc_c_1.jpg",
              "assets/aoc_c_2.jpeg",
              "assets/aoc_c_3.jpeg",
              "assets/aoc_c_4.jpeg",
              "assets/aoc_c_5.jpeg"
            ],
            "card_background": "linear-gradient(to bottom, #e7bdff 0, #d9ebfa 70%)",
            "title": "",
            "text_1": "Welcome to Age of Coins: Master of Spins — the ultimate spin & raid adventure! Spin the wheel, collect coins, attack enemies, and build your dream empire in this addictive coin game.",
            "text_2": "Play with millions of players around the world, climb the leaderboard, and become the true spin master of the ages!",
            "stat_left_line_1": "1M+",
            "stat_left_line_2": "Downloads",
            "stat_right_line_1": "4.8",
            "stat_right_line_2": "on Google Play",
            "google_play_url": "https://play.google.com/store/apps/details?id=com.casualgamesonline.coinslotsgame",
            "app_store_url": "https://apps.apple.com/us/app/age-of-coins-master-of-spins/id1540246787",
            "amazon_store_url": "https://www.amazon.com/Yadairgo-Trading-Limited-Age-Coins/dp/B0CRTP4KBS",
            "galaxy_store_url": "https://galaxystore.samsung.com/detail/com.my-studiogames.coinslotsgame?langCd=nl"
          },
          {
            "image": "assets/ma_icon.png",
            "header_image": "assets/ma_logo.png",
            "swiper_images": [
              "assets/ma_c_1.jpg",
              "assets/ma_c_2.jpg",
              "assets/ma_c_3.jpg",
              "assets/ma_c_4.jpg",
              "assets/ma_c_5.jpeg"
            ],
            "card_background": "linear-gradient(to bottom, #ffbdd6 0, #d9ebfa 70%)",
            "title": "",
            "text_1": "Try the ultimate roguelike archer RPG in a magical world full of fantasy battles and epic loot!",
            "text_2": "Enter a roleplaying adventure, where your archer hero fights monsters, explores dungeons, upgrades weapons and abilities, and defeats powerful bosses.",
            "stat_left_line_1": "500k+",
            "stat_left_line_2": "Downloads",
            "stat_right_line_1": "4.4",
            "stat_right_line_2": "on Google Play",
            "google_play_url": "https://play.google.com/store/apps/details?id=com.aftaa.magicarcher&hl=en",
            "app_store_url": "https://apps.apple.com/us/app/magic-archer-fantasy-rpg-game/id6503351190",
            "amazon_store_url": "",
            "galaxy_store_url": ""
          }
        ]
      }
    },
    {
      "type": "info_grid",
      "props": {
        "title": "Why join us",
        "items": [
          {
            "image": "assets/emoji_joy.png",
            "title": "Adaptable schedule",
            "text": "If the default working hours don’t suit you, we’re happy to adjust them to better fit your needs"
          },
          {
            "image": "assets/emoji_Medal.png",
            "title": "Professional growth",
            "text": "We offer competitive compensation with regular reviews, personalized development plans, and opportunities to explore new career paths"
          },
          {
            "image": "assets/emoji_salute.png",
            "title": "Work from anywhere",
            "text": "Join our team remotely from any location worldwide"
          },
          {
            "image": "assets/emoji_playful.png",
            "title": "Supportive team",
            "text": "We value transparency and a positive environment, with accessible leadership and open communication across the company"
          }
        ]
      }
    },
    {
      "type": "images_grid",
      "props": {
        "title": "",
        "images": [
          {
            "src": "assets/pic1.png",
            "alt": "Alec Monopoly pop art print in the My Studio office"
          },
          {
            "src": "assets/pic2.png",
            "alt": "Office shelf with Assassin's Creed figurines, awards, and designer collectibles"
          },
          {
            "src": "assets/pic3.png",
            "alt": "Colorful Alec Monopoly artwork celebrating luxury and champagne in the studio"
          },
          {
            "src": "assets/pic4.png",
            "alt": "My Studio open-plan office with dual monitors, blue beanbag, and pop art on the walls"
          },
          {
            "src": "assets/pic5.png",
            "alt": "My Studio lounge area with collectibles shelf, beanbags, and dual-monitor workstations"
          },
          {
            "src": "assets/pic6.png",
            "alt": "KAWS Companion and BAPE Be@rbrick figures on a windowsill overlooking the city"
          }
        ]
      }
    },
    {
      "type": "careers_tabs",
      "props": {
        "title": "Careers",
        "vacancies": [
          {
            "role": "UI Designer",
            "requirements": [
              "2+ years of relevant experience;",
              "A portfolio showcasing UI work for game projects with casual graphics;",
              "Understanding of UI/UX design principles;",
              "Proficiency in Adobe Photoshop;",
              "Proficiency in Figma;",
              "Strong artistic skills in creating icons, banners, and UI elements in a casual style."
            ],
            "responsibilities": [
              "Creating UI for mobile game projects with casual-style graphics based on provided specifications;",
              "Designing layouts and preparing state previews;",
              "Creating raster game icons;",
              "Maintaining a library of UI elements."
            ],
            "advantages": [
              "Option to work under a Cyprus-based contract with salary tied to EUR, or as an independent contractor (with vacation/holidays aligned to standard labor practices);",
              "An experienced team with a strong track record of successful releases;",
              "Remote work with a flexible schedule."
            ],
            "apply_url": "mailto:alena@my-studiodevs.com",
            "apply_label": "Apply"
          }
        ]
      }
    },
    {
      "type": "follow_us",
      "props": {
        "title": "Follow us"
      }
    }
  ]
}
