{
  "slug": "",
  "title": "Alexey Perov",
  "seo": {
    "description": "Developer tools for Unity, Flutter, and the web. Open-source Editor utilities, desktop apps, and AI tooling.",
    "og_image": "assets/github-logo.png"
  },
  "widgets": [
    {
      "type": "intro",
      "props": {
        "title": "",
        "paragraphs": [
          "Here you can find developer tools for Unity, Flutter, and the web — from Editor utilities that keep projects healthy to image processing apps and open-source text-editor.",
          "Focus is practical tooling: asset pipelines, project diagnostics, and utilities teams use every day.",
          "Everything on this site is open source under MIT or BSD-3-Clause; contributions and issue reports are welcome."
        ]
      }
    },
    {
      "type": "follow_us",
      "props": {
        "title": "Connect"
      }
    }
  ]
}
